"ElementName","DataType","Size","Required","ElementDescription","ValueRange","Notes","Aliases"
"manic_hypoeps","Integer","","Recommended","Manic and Hypomania Total Number of Hypomanic Episodes","","-99=N/A ; 88= Missing ; 77= Refused; -1=NK",""
"epino","Integer","","Recommended","Number of MDEs","","",""
"week","Float","","Recommended","Week in level/study","","99=week 10-week 14",""
"i1a","Integer","","Recommended","How old was the subject at the first onset of any psychiatric illness? (specify age in years)","","",""
"i7","Integer","","Recommended","Has any member of your family ever been
hospitalized for a psychiatric problem or a nervous breakdown?","0;1;9","0=No;1=Yes, 9=NK",""
"i8","Integer","","Recommended","Has any member of your family taken medicines to treat a psychiatric problem?","0;1;9","0=No;1=Yes, 9=NK",""
"i9","Integer","","Recommended","Has any member of your family lived in a group home or supervised housing?","0;1;9","0=No;1=Yes, 9=NK",""
"i10","Integer","","Recommended","Does any member of your family receive SSI or disability benefits?","0;1;9","0=No;1=Yes, 9=NK",""
"i11","Integer","","Recommended","Is any member of your family odd or eccentric?","0;1;9","0=No;1=Yes, 9=NK",""
"i11a","Integer","","Recommended","Is he/she withdrawn?","0;1;9","0=No;1=Yes, 9=NK",""
"i11b","Integer","","Recommended","Does he/she talk to himself/herself?","0;1;9","0=No;1=Yes, 9=NK",""
"i12a","Integer","","Recommended","Number of first degree relatives with a probable schizophrenia/bipolar spectrum disorders (DSM-IV Axis I and Axis II): schizophrenia, schizoaffective disorder, bipolar disorders, major depressive disorder, cluster A and cluster B personality disorders.","","",""
"i12b","Integer","","Recommended","Number of second degree relatives (e.g. grandparents, grandchildren, aunts, uncles,) with a probable schizophrenia/bipolar spectrum disorders (DSM-IV Axis I and Axis II): schizophrenia, schizoaffective disorder, bipolar disorders, major depressive disorder, cluster A and cluster B personality disorders.","","",""
"i12c","Integer","","Recommended","Number of third degree relatives (e.g. great- grandparents) with a probable schizophrenia/bipolar spectrum disorders (DSM-IV Axis I and Axis II): schizophrenia, schizoaffective disorder, bipolar disorders, major depressive disorder, cluster A and cluster B personality disorders.","","",""
"mania_range1","String","20","Recommended","Duration of Manic Episode 1","","mm/yyyy - mm/yyyy",""
"mania_range2","String","20","Recommended","Duration of Manic Episode 2","","mm/yyyy - mm/yyyy",""
"mania_range3","String","20","Recommended","Duration of Manic Episode 3","","mm/yyyy - mm/yyyy",""
"mania_range4","String","20","Recommended","Duration of Manic Episode 4","","mm/yyyy - mm/yyyy",""
"mania_range5","String","20","Recommended","Duration of Manic Episode 5","","mm/yyyy - mm/yyyy",""
"mania_range6","String","20","Recommended","Duration of Manic Episode 6","","mm/yyyy - mm/yyyy",""
"mania_range7","String","20","Recommended","Duration of Manic Episode 7","","mm/yyyy - mm/yyyy",""
"mania_range8","String","20","Recommended","Duration of Manic Episode 8","","mm/yyyy - mm/yyyy",""
"hypomania_range1","String","20","Recommended","Duration of Hypomanic Episode 1","","mm/yyyy - mm/yyyy",""
"hypomania_range2","String","20","Recommended","Duration of Hypomanic Episode 2","","mm/yyyy - mm/yyyy",""
"hypomania_range3","String","20","Recommended","Duration of Hypomanic Episode 3","","mm/yyyy - mm/yyyy",""
"hypomania_range4","String","20","Recommended","Duration of Hypomanic Episode 4","","mm/yyyy - mm/yyyy",""
"hypomania_range5","String","20","Recommended","Duration of Hypomanic Episode 5","","mm/yyyy - mm/yyyy",""
"hypomania_range6","String","20","Recommended","Duration of Hypomanic Episode 6","","mm/yyyy - mm/yyyy",""
"hypomania_range7","String","20","Recommended","Duration of Hypomanic Episode 7","","mm/yyyy - mm/yyyy",""
"hypomania_range8","String","20","Recommended","Duration of Hypomanic Episode 8","","mm/yyyy - mm/yyyy",""
"mdd_range1","String","20","Recommended","Duration of Major Depressive Episode 1","","mm/yyyy - mm/yyyy",""
"mdd_range2","String","20","Recommended","Duration of Major Depressive Episode 2","","mm/yyyy - mm/yyyy",""
"mdd_range3","String","20","Recommended","Duration of Major Depressive Episode 3","","mm/yyyy - mm/yyyy",""
"mdd_range4","String","20","Recommended","Duration of Major Depressive Episode 4","","mm/yyyy - mm/yyyy",""
"mdd_range5","String","20","Recommended","Duration of Major Depressive Episode 5","","mm/yyyy - mm/yyyy",""
"mdd_range6","String","20","Recommended","Duration of Major Depressive Episode 6","","mm/yyyy - mm/yyyy",""
"mdd_range7","String","20","Recommended","Duration of Major Depressive Episode 7","","mm/yyyy - mm/yyyy",""
"mdd_range8","String","20","Recommended","Duration of Major Depressive Episode 8","","mm/yyyy - mm/yyyy",""
"mdd_range9","String","20","Recommended","Duration of Major Depressive Episode 9","","mm/yyyy - mm/yyyy",""
"dysthymia_1","String","20","Recommended","Duration of Dysthymic Episode 1","","mm/yyyy - mm/yyyy",""
"dysthymia_2","String","20","Recommended","Duration of Dysthymic Episode 2","","mm/yyyy - mm/yyyy",""
"dysthymia_3","String","20","Recommended","Duration of Dysthymic Episode 3","","mm/yyyy - mm/yyyy",""
"psychosis_no","Integer","","Recommended","Number of Psychotic Episodes","","96 = too numerous for form; 99 = number unknown",""
"psychosis_range1","String","20","Recommended","Duration of Psychotic Episode 1","","mm/yyyy - mm/yyyy",""
"psychosis_range2","String","20","Recommended","Duration of Psychotic Episode 2","","mm/yyyy - mm/yyyy",""
"psychosis_range3","String","20","Recommended","Duration of Psychotic Episode 3","","mm/yyyy - mm/yyyy",""
"psychosis_range4","String","20","Recommended","Duration of Psychotic Episode 4","","mm/yyyy - mm/yyyy",""
"psychosis_range5","String","20","Recommended","Duration of Psychotic Episode 5","","mm/yyyy - mm/yyyy",""
"psychosis_range6","String","20","Recommended","Duration of Psychotic Episode 6","","mm/yyyy - mm/yyyy",""
"psychosis_range7","String","20","Recommended","Duration of Psychotic Episode 7","","mm/yyyy - mm/yyyy",""
"psychosis_range8","String","20","Recommended","Duration of Psychotic Episode 8","","mm/yyyy - mm/yyyy",""
"comments_misc","String","4000","Recommended","Miscellaneous comments on study, interview, methodology relevant to this form data","","",""
"site","String","101","Recommended","Site","","Study Site","siteid"
"version_form","String","121","Recommended","Form used/assessment name","","","form"
"visit","String","60","Recommended","Visit name","","","visitnum"
"prevlifemedhist","Float","","Recommended","Lifetime Total Exposure","","Total Lifetime Exposure Measure of Anti-Psychiatric Drugs, measured in grams",""
"frstpsychdt","Date","","Recommended","Date of the subject�s first episode of psychosis?","","MM/DD/YYYY",""
"psychtrtdt","Date","","Recommended","Date of first treatment for Psychosis?","","MM/DD/YYYY",""
"recentepisode_psy","Date","","Recommended","Date of most recent episode or exacerbation of psychosis?","","MM/DD/YYYY",""
"a_4a_date_of_the_subject_s_mos","Date","","Recommended","Date of the subject's most recent hospitalization","","MM/DD/YYYY",""
"suicatmpdt","Date","","Recommended","suicide attempt, Most Recent Date:","","MM/DD/YYYY",""
"chf_method1","String","250","Recommended","1st suicide attempt method","","","suicatmptmthd"
"cssrs_base_13","Integer","","Recommended","Baseline. Que 13 - Suicidal Behavior: Interrupted Attempt","0;1; -9","0=No; 1=Yes; -9=Missing/NA/NK","suicatmpintrp"
"intrpatmpdt","Date","","Recommended","suicide interrupted attempt If yes, Most Recent Date:","","MM/DD/YYYY",""
"cssrs_base_13b","String","1000","Recommended","Baseline. Que 13b - Suicidal Behavior: Interrupted attempt description","","","intrpatmptmthd"
"sblw02","Integer","","Recommended","Suicidal Behavior Last Week: Aborted Attempt","0;1","0=No; 1=Yes","abrtatmpt"
"abortatmpdt","Date","","Recommended","suicide aborted If yes, Most Recent Date:","","MM/DD/YYYY",""
"cssrs_base_14b","String","250","Recommended","Baseline. Que 14b - Suicidal Behavior: Aborted attempt description","","","abrtatmptmthd"
"injectmed","Integer","","Recommended","Have you received an injectable medication in the past 90 days?  (If yes, record on Concomitant Medications/Therapy log)","0;1","1=Yes; 0=No",""
"stopmed","Integer","","Recommended","Has the subject stopped any medications (i.e. pills, vitamins, topical, patches, etc)in the past 4 weeks? (If yes, record on Concomitant Medications/Therapy log)","0;1","1=Yes; 0=No",""
"prevalac","Integer","","Recommended","Have you ever taken Valacyclovir or Acyclovir?","0;1","1=Yes; 0=No",""
"elig_23","Integer","","Recommended","Suicidal","0;1","0=No; 1=Yes","aemarksuicid"
"respondent","String","20","Recommended","Respondent","Mother;Father;Parent;Guardian;Teacher;Child;Self;Caregiver;Partner;Other","",""
"su1","Integer","","Recommended","Prior to this hospitalization, have you gone anywhere or seen anyone for mental health services
or alcohol/drug use treatment - a physician, social worker, drug or alcohol detox clinic, a
hospital, or any other community agency or professional?","0;1","0= No; 1= Yes","psychhist_mentalhealth"
"hx_psymeds","Integer","","Recommended","Have you ever been prescribed psychiatric medication?","0; 1","0= No; 1= Yes","psychhist_psycmeds"
"anytherapy","Integer","","Recommended","Any psychotherapy for anxiety, depression, ADHD, or other emotional or behavioral difficulties","0;1","0 = No; 1 = Yes","psychhist_therapy_curr"
"past_therapy","Integer","","Recommended","In the past have you ever been in talk therapy or counseling for emotional problems?","0;1","0=No; 1=Yes","psychhist_therapy_past"
"asap10e","Integer","","Recommended","outside clinicians/services: Psychiatric hospitalization for patient","0;1; 88","0 = No;1 = Yes; 88= No information","psychhist_hosp_psyc"
"cfmh_chd_depression","Integer","","Recommended","Does (did) the Child have Depression?","1;0;999","0 = No; 1 = Yes","psychhist_dep"
"bipolar","Integer","","Recommended","Bipolar Disorder","0 :: 1; -9","0=Not Selected; 1=Selected; -9=Missing (Question not answered)","psychhist_bipolar"
"anxiety_yes","Integer","","Recommended","Any Anxiety Disorder is Present","0;1","0 = No; 1 = Yes","psychhist_anxietydis"
"cdiag_ocd","Integer","","Recommended","Child current diagnosis: OCD","0;1","0=No; 1=Yes","psychhist_ocd"
"cfmh_chd_schizo","Integer","","Recommended","Does (did) the Participant have Schizophrenia?","0::2;999; -7","0 = No; 1 = Yes; 2=Probable;-7=Refused; 999=NA/NK/missing","psychhist_schiz"
"baseline_k_014","Integer","","Recommended","An eating disorder, like anorexia or bulimia?","0::3; -888; -999","0=No; 1=Yes; -888=Not Applicable; -999=Missing;2=Current; 3=Both Current and Lifetime","psychhist_eatingdis"
"adhd_diagnosis","Integer","","Recommended","Attention Deficit Disorder: Formal diagnosis","0;1;-7;-8;-9","0 = No; 1 = Yes; -7 = Don't know; -8 = Refused to answer; -9 = Does not apply","psychhist_adhd"
"tourettes_formaldiagnosis","Integer","","Recommended","Tourette's syndrome: Formal diagnosis","0; 1; -7; -8; -9","0 = No; 1 = Yes; -7 = Don't know; -8 = Refused to answer; -9 = Does not apply","psychhist_tourettes"
"trichotillomania","Integer","","Recommended","Trichotillomania","0;1","0=No; 1=Yes","psychhist_trich"
"dph00a6","Integer","","Recommended","History of substance abuse","0;1","0=No; 1=Yes","psychhist_substanceabuse"
"impact_trauma","Integer","","Recommended","Past traumatic experiences (abuse or other)","0;1;-99;88;77","0= No ; 1= Yes ; -99= N/A ; 88= Missing ; 77= Refused","psychhist_trauma"
"w1_m_cu_learning","Integer","","Recommended","health at interview - learning disability history","0;1; -888; -999","0 = No; 1 = Yes; -999 = missing; -888 = not applicable","psychhist_learningdis"
"anxiety_notes","String","300","Recommended","Notes","","","psychhist_anxietydis_list"
"fam_hx_psy","String","300","Recommended","Please describe your family history of emotional difficulties and/or psychiatric treatment.","","","psychhist_relative_text"
"psychhist_behaviorprob","Integer","","Recommended","Have you ever been diagnosed with Behavioral or conduct problems?","0;1","0=no; 1=yes",""
"psychhist_neurodamage","Integer","","Recommended","Have you ever been diagnosed with Significant neurological damage?","0;1","0=no; 1=yes",""
"psychhist_relative","Integer","","Recommended","Do you have a first degree relative who has been diagnosed with a psychiatric disorder? ","0;1","0=no; 1=yes",""
"diagnoses_1","String","4000","Recommended","List all diagnosis here","","","p_diagnosis"
"p_manic","Integer","","Recommended","Has the participant ever had manic episode?","0::1","0=No; 1=Yes",""
"p_manic_1","String","2000","Recommended","How many total manic episodes across the lifetime?","","",""
"p_manic_2","String","2000","Recommended","How many of these manic episodes were associated with hospitalization?","","",""
"p_manic_3","String","2000","Recommended","How many manic episodes in the past five years?","","",""
"p_manic_4","String","2000","Recommended","How many manic episodes in the past year?","","",""
"p_manic_5","String","2000","Recommended","Age of onset of first manic episode:","","",""
"p_manic_6","String","2000","Recommended","Age of most recent manic episode:","","",""
"p_depress","Integer","","Recommended","Has the participant ever had depressive episode?","0::1","0=No; 1=Yes",""
"p_depress_1","String","2000","Recommended","How many total depressive episodes across the lifetime?","","",""
"p_depress_2","String","2000","Recommended","How many of these depressive episodes were associated with hospitalization?","","",""
"p_depress_3","String","2000","Recommended","How many depressive episodes in the past five years?","","",""
"p_depress_4","String","2000","Recommended","How many depressive episodes in the past year?","","",""
"p_depress_5","String","2000","Recommended","Age of onset of first depressive episode:","","",""
"p_depress_6","String","2000","Recommended","Age of most recent depressive episode:","","",""
"cepisp","String","500","Recommended","Current diagnosis specify","","","ph_1"
"a1_ad1a_o","String","300","Recommended","Specify other person suspected diagnosis","","","ph_2"
"fh_1","Integer","","Recommended","Family history of psychiatric disorder other than schizophrenia (OPCRIT 14)","0;1","0=No; 1=Yes",""
"fh_2","Integer","","Recommended","Family history of schizophrenia (OPCRIT 13)","0;1"," 0 = No; 1 = Yes",""
"pmh3","Integer","","Recommended","Diagnostic Interview for Psychoses (DIP) Diagnosis","0;1","0=Schizoaffective disorder; 1=Schizophrenia","ph_3"
"pmh4","Integer","","Recommended","Age when schizoaffective disorder or schizophrenia symptoms were first noticed (years)","","","ph_4"
"pmh7","Integer","","Recommended","Duration of illness since symptoms were first noticed (years)","","","ph_7"
"pmh8","Integer","","Recommended","Duration of illness schizoaffective disorder or schizophrenia since diagnosis (years)","","","ph_8"
"pmh5","Integer","","Recommended","Age when definitive diagnosis was made (years)","","","ph_5"
