"ElementName","DataType","Size","Required","ElementDescription","ValueRange","Notes","Aliases"
"subjectkey","GUID","","Required","The NDAR Global Unique Identifier (GUID) for research subject","NDAR*","",""
"src_subject_id","String","20","Required","Subject ID how it's defined in lab/project","","","record_id"
"interview_date","Date","","Required","Date on which the interview/genetic test/sampling/imaging/biospecimen was completed. MM/DD/YYYY","","","date_of_interview_contact,date_psychhx,visit_date"
"interview_age","Integer","","Required","Age in months at the time of the interview/test/sampling/imaging.","0 :: 1260","Age is rounded to chronological month. If the research participant is 15-days-old at time of interview, the appropriate value would be 0 months. If the participant is 16-days-old, the value would be 1 month.","age"
"sex","String","20","Required","Sex of subject at birth","M;F; O; NR","M = Male; F = Female; O=Other; NR = Not reported","gender,sex"
"cfmh_chd_bipolar","Integer","","Recommended","Does (did) the subject have a Bipolar Disorder?","1;0;999;9","0 = No; 1 = Yes","bpever"
"bponset","Integer","","Recommended","How old was the subject at the first onset of symptoms of Bipolar Disorder? (specify age in years)","","",""
"bpdx","Integer","","Recommended","How old was the subject when she/he was first diagnosed with Bipolar Disorder? (specify age in years)","","",""
"mini_dd3","Integer","","Recommended","Differential Diagnosis: Does the patient code positive for current and/or past manic episode?","0;1","0=No; 1=Yes","manever"
"manic_age","Integer","","Recommended","Manic and Hypomania Age of Onset",""," -9=Unknown","manage"
"macnumep","Integer","","Recommended","Total number of episodes of manic syndrome, including current","","99 = too numerous or indistinct to count;  -9=Unknown","mancount"
"mini_dd1","Integer","","Recommended","Differential Diagnosis: Does the patient code positive for current and/or past major depressive episode?","0;1","0=No; 1=Yes","mddever"
"dage","Integer","","Recommended","Age at onset of first MDE (major depressive episode)","","-9=Unknown","mddage"
"p2i6","Integer","","Recommended","Major Depressive Episode - Best estimate of number of episodes","","96 = too numerous for form; -9 = number unknown","mddcount"
"dt1p","Integer","","Recommended","Ever had psychotic symptoms","0;1","0=No; 1=Yes","psylife"
"hallud","Integer","","Recommended","Hallucinations","0;1; -9","0=No; 1=Yes; -9=unknown","psytype_hall"
"delusd","Integer","","Recommended","Delusions","0;1","0=No; 1=Yes","psytype_delus"
"psytype_disord","Integer","","Recommended","Thought disorder (e.g., tangentiality, loose associations, neologisms, thought blocking)","0;1","1 = Checked; 0 = Unchecked",""
"psytype_disorg","Integer","","Recommended","Disorganized/bizarre thought process and/or behavior","0;1","1 = Checked; 0 = Unchecked",""
"psymood_congruent","Integer","","Recommended","Mood-congruent (e.g., grandiose delusions during manic episode, delusion of guilt during depressive episode, derogatory auditory hallucinations during depressive episode)","1;0","1 = Checked; 0 = Unchecked",""
"psymood_incongruent","Integer","","Recommended","Mood-incongruent (e.g., paranoid or persecutory delusions during manic or depressive episode)","1;0","1 = Checked; 0 = Unchecked",""
"hpl_02","Integer","","Recommended","Age at first psychotic symptoms, e.g. delusions, hallucinations, thought disorder","","in years","psyfirst"
"psydep","Integer","","Recommended","How many depressive psychotic episodes has the subject had (lifetime)? (number of episodes)","","",""
"psymanmix","Integer","","Recommended","How many manic and/or mixed psychotic episodes has the subject had (lifetime)? (number of episodes)","","",""
"psyconfident","Integer","","Recommended","How confident is the rater in the approximation of number of psychotic mood episodes? (please check only one)","1::3","1 = Very confident; 2 = Moderately confident; 3 = Not confident",""
"hospever","Integer","","Recommended","Has the subject ever been hospitalized for psychiatric reasons including substance use (lifetime)?","0;1;9","1 = Yes; 0 = No; 9 = Unknown",""
"age_1st_hosp","Integer","","Recommended","Age at first psychiatric hospitalization (years)","","","hospage"
"hospcount","Integer","","Recommended","How many psychiatric hospitalizations has the subject had (lifetime)? (number of episodes)","","","a4_number_of_past_psychiatric_,ph_6"
"ectever","Integer","","Recommended","Has the subject ever received an ECT?","0;1;9","1 = Yes; 0 = No; 9 = Unknown",""
"brnins","Integer","","Recommended","Has the subject had any brain insults accompanied by loss of consciousness (lifetime)?","0;1;9","1 = Yes; 0 = No; 9 = Unknown",""
"brninscount","Integer","","Recommended","Total number of brain insults (e.g., traumatic brain injury, hypoxia) accompanied by any loss of consciousness in lifetime","","",""
"consduration","Integer","","Recommended","The longest duration of loss of consciousness in lifetime (specify duration in seconds)","","",""
"suicisev","Integer","","Recommended","Rate the most severe suicidal tendencies in lifetime (please choose only one, the highest rating)","1::7;9","1 = Absent; 2 = Thoughts of dying, but no suicidal thoughts; 3 = Occasional thoughts of suicide, no plans; 4 = Often thought about suicide or has thought of a specific method; 5 = Had a plan or made a suicidal gesture (i.e., an attempt without intent to die); 6 = Made preparations for a potentially serious suicide attempt 7 = Suicide attempt with definite intent to die or be potentially medically harmful; 9 = Unknown",""
"suiciever","Integer","","Recommended","Has the subject ever attempted suicide (include 'true' suicide attempts and/or suicide gestures)?","0;1;9","1 = Yes; 0 = No; 9 = Unknown","suicatmpt"
"sheehan_11","Integer","","Recommended","11. Over your lifetime, how many times did you attempt suicide?","","","ph_9,suicicount"
"suiciage","Integer","","Recommended","How old was the subject during the most severe suicide attempt? (specify age in years)","","",""
"suicimode_drug","Integer","","Recommended","suicide Drug overdose","1;0","1 = Checked; 0 = Unchecked",""
"suicimode_cut","Integer","","Recommended","suicide Cutting","1;0","1 = Checked; 0 = Unchecked",""
"suicimode_firearm","Integer","","Recommended","suicide Firearm use/shooting","1;0","1 = Checked; 0 = Unchecked",""
"suicimode_hang","Integer","","Recommended","suicide Hanging","1;0","1 = Checked; 0 = Unchecked",""
"suicimode_jump","Integer","","Recommended","suicide Jumping","1;0","1 = Checked; 0 = Unchecked",""
"suicimode_burn","Integer","","Recommended","suicide Immolation/burning","1;0","1 = Checked; 0 = Unchecked",""
"suicimode_drown","Integer","","Recommended","suicide Drowning","1;0","1 = Checked; 0 = Unchecked",""
"suicimode_other","Integer","","Recommended","suicide Other","1;0","1 = Checked; 0 = Unchecked",""
"suiciintend","Integer","","Recommended","Did the subject intend to end his life/die during the most severe suicide attempt?","0;1;9","1 = Yes; 0 = No; 9 = Unknown",""
"use_cannabis","Integer","","Recommended","does the parent think the subject has ever used cannabis","0 :: 2","0 = No information; 1 = No; 2 = Yes","canever"
"canage","Integer","","Recommended","How old was the subject during first use of cannabis? (specify age in years)","","",""
"canbefore","Integer","","Recommended","Before age 18 how many times did the subject use cannabis? (please check only one)","1::6;9","1 = None; 2 = 1-4 times; 3 = 5-10 times; 4 = 11-50 times; 5 = 51-100 times; 6 = >100 times; 9 = Unknown",""
"canafter","Integer","","Recommended","After age 18 how many times did the subject use cannabis? (please check only one)","1::6;9","1 = None; 2 = 1-4 times; 3 = 5-10 times; 4 = 11-50 times; 5 = 51-100 times; 6 = >100 times; 9 = Unknown",""
"cansyn","Integer","","Recommended","Has the subject ever used synthetic cannabis (e.g., 'K2', 'spice', 'mojo')?","0;1;2;3;9","1 = Yes; 0 = No; 2 = Yes, in the last 12 months;3 = Yes, but not in the last 12 months;9 = Unknown",""
"cansynbefore","Integer","","Recommended","Did the subject use synthetic cannabis before age 18?","0;1;9","1 = Yes; 0 = No; 9 = Unknown",""
"canlast","Date","","Recommended","When was the last time the subject used cannabis? Approximate date","","",""
"canconfident","Integer","","Recommended","How confident is the rater in the date approximation? (please check only one)","1::3","1 = Very confident; 2 = Moderately confident; 3 = Not confident",""
"canprescribe_pre","Integer","","Recommended","Canibis Prescribed","1;0","1 = Checked; 0 = Unchecked",""
"canprescribe_nonpre","Integer","","Recommended","Canibis Non-prescribed","1;0","1 = Checked; 0 = Unchecked",""
"use_stimulants","Integer","","Recommended","does the parent think the subject has ever used stimulants","0 :: 2","0 = No information; 1 = No; 2 = Yes","stimever"
"first_use_age_stimulants","Integer","","Recommended","How old were you when you FIRST used Stimulants? PX031201_First_Use_Age_Stimulants","1::99","Age in years","stimage"
"stimbefore","Integer","","Recommended","Before age 18 how many times did the subject use stimulants? (please check only one)","1::6;9","1 = None; 2 = 1-4 times; 3 = 5-10 times; 4 = 11-50 times; 5 = 51-100 times; 6 = >100 times; 9 = Unknown",""
"stimafter","Integer","","Recommended","After age 18 how many times did the subject use stimulants? (please check only one)","1::6;9","1 = None; 2 = 1-4 times; 3 = 5-10 times; 4 = 11-50 times; 5 = 51-100 times; 6 = >100 times; 9 = Unknown",""
"stimlast","Date","","Recommended","When was the last time the subject used stimulants? Approximate date","","",""
"stimconfident","Integer","","Recommended","How confident is the rater in the date approximation? (please check only one)","1::3","1 = Very confident; 2 = Moderately confident; 3 = Not confident",""
"stimprescribe_pre","Integer","","Recommended","Stimulants Prescribed","1;0","1 = Checked; 0 = Unchecked",""
"stimprescribe_nonpre","Integer","","Recommended","Stimulants Non-prescribed","1;0","1 = Checked; 0 = Unchecked",""
"use_cocaine","Integer","","Recommended","does the parent think the subject has ever used cocaine","0 :: 2","0 = No information; 1 = No; 2 = Yes","cocaineever"
"first_use_age_cocaine","Integer","","Recommended","How old were you when you FIRST used Cocaine or Crack? PX031201_First_Use_Age_Cocaine","1::99","Age in years","cocaineage"
"cocainebefore","Integer","","Recommended","Before age 18 how many times did the subject use cocaine? (please check only one)","1::6;9","1 = None; 2 = 1-4 times; 3 = 5-10 times; 4 = 11-50 times; 5 = 51-100 times; 6 = >100 times; 9 = Unknown",""
"cocaineafter","Integer","","Recommended","After age 18 how many times did the subject use cocaine? (please check only one)","1::6;9","1 = None; 2 = 1-4 times; 3 = 5-10 times; 4 = 11-50 times; 5 = 51-100 times; 6 = >100 times; 9 = Unknown",""
"cocainelast","Date","","Recommended","When was the last time the subject used cocaine? Approximate date","","",""
"cocaineconfident","Integer","","Recommended","How confident is the rater in the date approximation? (please check only one)","1::3","1 = Very confident; 2 = Moderately confident; 3 = Not confident",""
"use_halluc","Integer","","Recommended","does the parent think the subject has ever used hallucinogens","0 :: 2","0 = No information; 1 = No; 2 = Yes","hallever"
"subus33","Integer","","Recommended","Age at first treatment or hospitalization for substance use (in years)","","","hallage"
"hallbefore","Integer","","Recommended","Before age 18 how many times did the subject use hallucinogens? (please check only one)","1::6;9","1 = None; 2 = 1-4 times; 3 = 5-10 times; 4 = 11-50 times; 5 = 51-100 times; 6 = >100 times; 9 = Unknown",""
"hallafter","Integer","","Recommended","After age 18 how many times did the subject use hallucinogens? (please check only one)","1::6;9","1 = None; 2 = 1-4 times; 3 = 5-10 times; 4 = 11-50 times; 5 = 51-100 times; 6 = >100 times; 9 = Unknown",""
"halllast","Date","","Recommended","When was the last time the subject used hallucinogens? Approximate date","","",""
"hallconfident","Integer","","Recommended","How confident is the rater in the date approximation? (please check only one)","1::3","1 = Very confident; 2 = Moderately confident; 3 = Not confident",""
"use_opiods","Integer","","Recommended","does the parent think the subject has ever used opiods","0 :: 2","0 = No information; 1 = No; 2 = Yes","opiever"
"opiage","Integer","","Recommended","Age during first use of opioids? (specify age in years)","","",""
"opibefore","Integer","","Recommended","Before age 18 how many times did the subject use opioids? (please check only one)","1::6;9","1 = None; 2 = 1-4 times; 3 = 5-10 times; 4 = 11-50 times; 5 = 51-100 times; 6 = >100 times; 9 = Unknown",""
"opiafter","Integer","","Recommended","After age 18 how many times did the subject use opioids? (please check only one)","1::6;9","1 = None; 2 = 1-4 times; 3 = 5-10 times; 4 = 11-50 times; 5 = 51-100 times; 6 = >100 times; 9 = Unknown",""
"opilast","Date","","Recommended","When was the last time the subject used opioids? Approximate date","","",""
"opiconfident","Integer","","Recommended","How confident is the rater in the date approximation? (please check only one)","1::3","1 = Very confident; 2 = Moderately confident; 3 = Not confident",""
"opiprescribe_pre","Integer","","Recommended","Opioid Prescribed","1;0","1 = Checked; 0 = Unchecked",""
"opiprescribe_nonpre","Integer","","Recommended","opioid Non-prescribed","1;0","1 = Checked; 0 = Unchecked",""
"use_other","Integer","","Recommended","does the parent think the subject has ever used other substances","0 :: 2","0 = No information; 1 = No; 2 = Yes","subothever"
"subothage","Integer","","Recommended","Age during first use of other substances? (specify age in years)","","",""
"subothbefore","Integer","","Recommended","Before age 18 how many times did the subject use other substances? (please check only one)","1::6;9","1 = None; 2 = 1-4 times; 3 = 5-10 times; 4 = 11-50 times; 5 = 51-100 times; 6 = >100 times; 9 = Unknown",""
"subothafter","Integer","","Recommended","After age 18 how many times did the subject use other substances? (please check only one)","1::6;9","1 = None; 2 = 1-4 times; 3 = 5-10 times; 4 = 11-50 times; 5 = 51-100 times; 6 = >100 times; 9 = Unknown",""
"subothlast","Date","","Recommended","When was the last time the subject used other substances? Approximate date","","",""
"subothconfident","Integer","","Recommended","How confident is the rater in the date approximation? (please check only one)","1::3","1 = Very confident; 2 = Moderately confident; 3 = Not confident",""
"subothprescribe_pre","Integer","","Recommended","Other substance Prescribed","1;0","1 = Checked; 0 = Unchecked",""
"subothprescribe_nonpre","Integer","","Recommended","Other substance Non-prescribed","1;0","1 = Checked; 0 = Unchecked",""
"date_menst_psychhx","String","30","Recommended","First date of the last menstrual cycle (females only)","","",""
"aller","Integer","","Recommended","Allergies, Medications","0;1;9","1 = Yes; 0 = No; 9 = Unknown",""
"midihist_002","Integer","","Recommended","Allergies- Other","1;2;9;-999","1=No History; 2=Yes; 9=Not evaluated; -999= Don't know/Missing Data","alleroth"
"heent","String","10","Recommended","Heent exam","normal; abnormal; other","",""
"cardio_disorder","Integer","","Recommended","Cardiovascular Disorder (Heart, Vessels)","0;1;9","1 = Yes; 0 = No; 9 = Unknown","cardio"
"mhxa1c","Integer","","Recommended","Coronary artery disease","0;1; -9","0=No; 1=Yes; -9 =NK","coronary"
"lhq_hyp","Integer","","Recommended","Hypertension","0;1; -7;-9","0=No; 1=Yes; -7=Refused; -9=Unknown","hypert"
"cardiooth","Integer","","Recommended","Other Cardio","0;1;9","1 = Yes; 0 = No; 9 = Unknown",""
"mhx005a","Integer","","Recommended","History of: Renal disorder","1::3;9","1=No; 2=Yes; 3=Yes, Inactive;9=not evaluated","renal,renal_dis"
"hepat","Integer","","Recommended","Hepatitis","1;0;-7; -9 ","0=No; 1=Yes;-7=Refused; -9 =unknown",""
"mhx007aa","Integer","","Recommended","History of: Pulmonary disorder","1::3;9","1=No; 2=Yes; 3=Yes, Inactive;9=not evaluated","pulmon"
"gastro","Integer","","Recommended","Gastrointestinal Disorder (Stomach, Bowels)","0;1;9","1 = Yes; 0 = No; 9 = Unknown",""
"muscul","Integer","","Recommended","Musculoskeletal Disorder (Muscles, Joints, Spine)","0;1;9","1 = Yes; 0 = No; 9 = Unknown",""
"neuro_dis","Integer","","Recommended","Neurologic Disorder (Brain, Spinal Cord, Peripheral Nerves)","0;1;9","1 = Yes; 0 = No; 9 = Unknown","neuro"
"mhx013a","Integer","","Recommended","History of: Dermatologic disorder","1::3;9","1=No; 2=Yes;9=not evaluated","derma"
"mhmetabe","Integer","","Recommended","Metabolic Disorder","1::4;-9;9","1=No history 2=Yes, excludes;3=Yes, does not exclude; -9 =unknown;4=Yes; 9=not evaluated","meta"
"baseline_k_005","Integer","","Recommended","Has she/he ever been to a doctor for any of these things…Diabetes /Diabetes","0;1; -888; -999;-7","0=No; 1=Yes; -888=Not Applicable; -999=Missing/NK; -7=Refused //Now I'd like to ask you about your child's use of health services during the past year and throughout his/her whole life.","diabetes,diabetes_dis"
"mdga10","Integer","","Recommended","Diagnosed with: Hyperlipidemia","0;1; -9","0=No; 1=Yes; -9=unknown","hyperlip"
"cfmh_othr_obesity","Integer","","Recommended","Obesity","1;0","0 = No; 1 = Yes","obesity"
"metaoth","Integer","","Recommended","Other","0;1;9","1 = Yes; 0 = No; 9 = Unknown",""
"hemato","Integer","","Recommended","Hematologic Disorder (Blood Disorders)","0;1;9","1 = Yes; 0 = No; 9 = Unknown",""
"endoc","Integer","","Recommended","Endocrine Disorder (Thyroid gland, Adrenal glands, etc.)","0;1;9","1 = Yes; 0 = No; 9 = Unknown",""
"genit_dis","Integer","","Recommended","Genitourinary Disorder (Bladder, Reproductive System)","0;1;9","1 = Yes; 0 = No; 9 = Unknown","genit"
"medprob_inf","String","50","Recommended","Infectious Disease: Is there any known abnormality in this area","No;Yes;Don't Know","","infectious"
"phystrau","Integer","","Recommended","Physical Trauma","0;1;9","1 = Yes; 0 = No; 9 = Unknown",""
"psqb12","Integer","","Recommended","Child ever had surgery","0::2; 9","0 = No; 1 = Yes; 2 = Do not know; -9 = Missing value","surgery"
"baseline_k_003","Integer","","Recommended","Cancer","0;1;-888;-999","0=No; 1=Yes; -888=Not Applicable; -999=Missing;","cancer"
"szsadbp","Integer","","Recommended","Does the subject have Schizophrenia, Schizoaffective Disorder, or Psychotic Bipolar Disorder?","0;1;9","1 = Yes; 0 = No; 9 = Unknown",""
"szsadbponset","Integer","","Recommended","How old was the subject at the first symptom onset of SZ, SAD, or Psychotic BD? (specify age in years)","","specify age in years",""
"szsadbpdx","Integer","","Recommended","How old was the subject when she/he was first
diagnosed with SZ, SAD, or Psychotic BD? (specify age in years)","","specify age in years",""
"psytype_cata","Integer","","Recommended","Catatonia","0;1","1 = Checked; 0 = Unchecked",""
"onset_type","Integer","","Recommended","What was the type of onset of psychotic symptoms?
(Acute onset: less than 6 months from first psychotic symptoms to frank psychosis onset; Insidious onset: more than 6 months from first psychotic symptoms to frank psychosis onset)","1::3","1 = Acute; 2 = Insidious; 3 = Unknown",""
"lt_co_psy","Integer","","Recommended","What has the lifetime course of psychotic symptoms been? (please check only one)","1::4","1 = Episodic; 2 = Chronic; 3 = With both episodic and chronic features; 4 = Unknown",""
"lt_du_psy","Float","","Recommended","What has the lifetime duration of psychotic
symptoms been? (specify in months)
(Indicate total cumulative duration of psychotic symptoms in lifetime)","","specify in months",""
"psyconfident_b2","Integer","","Recommended","How confident is the rater in the data pertinent to
lifetime psychotic symptoms?
(please answer for all subjects; check only one)","1::3","1 = Very confident; 2 = Moderately confident; 3 = Not confident",""
"lt_co_dep","Integer","","Recommended","What has the lifetime course of depressive symptoms been? (please check only one)","1::4","1 = Episodic; 2 = Chronic; 3 = With both episodic and chronic features; 4 = Unknown",""
"lt_du_dep","Float","","Recommended","What has the lifetime duration of depressive symptoms been? (specify in months)","","specify in months",""
"lt_co_man","Integer","","Recommended","What has the lifetime course of manic symptoms been? (please check only one):","1::4","1 = Episodic; 2 = Chronic; 3 = With both episodic and chronic features; 4 = Unknown",""
"lt_du_man","Float","","Recommended","What has the lifetime duration of manic symptoms
been?     (specify in months)","","specify in months",""
"mix_ever","Integer","","Recommended","Has the subject ever had Mixed Episode?","0;1;9","1 = Yes; 0 = No; 9 = Unknown",""
"mix_age","Integer","","Recommended","How old was the subject at the time of first mixed
episode? (specify age in years)","","specify age in years",""
"mix_count","Integer","","Recommended","How many mixed episodes has the subject had
(lifetime)? (number of episodes)","","number of episodes",""
"mixcount_many","Integer","","Recommended","Too many to count flag","1","1 = Too many to count",""
"moodconfident_b2","Integer","","Recommended","How confident is the rater in the data pertinent to
lifetime mood symptoms?
(please answer for all subjects; check only one)","1::3","1 = Very confident; 2 = Moderately confident; 3 = Not confident",""
"lt_psymood","Integer","","Recommended","Did the subject have overlapping psychotic and mood symptoms in lifetime?","0;1;9","1 = Yes; 0 = No; 9 = Unknown",""
"lt_overall","Integer","","Recommended","The overall course of illness manifested predominantly with (Please check only one) (lifetime)","1::4","1 = Psychotic Symptoms; 2 = Mood Symptoms; 3 = Both; 4 = NA",""
"interconfident_b2","Integer","","Recommended","How confident is the rater in the data pertinent to
interrelated mood and psychotic symptoms?
(please answer for all subjects; check only one)","1::3","1 = Very confident; 2 = Moderately confident; 3 = Not confident",""
"alcever","Integer","","Recommended","Has the subject ever drunk alcohol?","0;1;9","1 = Yes; 0 = No; 9 = Unknown",""
"alcage","Integer","","Recommended","Age during first use of alcohol?
(specify age in years)","","specify age in years",""
"alcbefore","Integer","","Recommended","Before age 18, how many times did the subject use alcohol? (please check only one)","1::6; 9","1 = None; 2 = 1-4 times; 3 = 5-10 times; 4 = 11-50 times; 5 = 51-100 times; 6 = >100 times; 9 = Unknown",""
"alcafter","Integer","","Recommended","After age 18, how many times did the subject use alcohol? (please check only one)","1::6; 9","1 = None; 2 = 1-4 times; 3 = 5-10 times; 4 = 11-50 times; 5 = 51-100 times; 6 = >100 times; 9 = Unknown",""
"alclast","Date","","Recommended","When was the last time the subject used alcohol? Approximate date","","Approximate date",""
"alcconfident_b2","Integer","","Recommended","How confident is the rater in the data pertinent to alcohol use? (please check only one)","1::3","1 = Very confident; 2 = Moderately confident; 3 = Not confident",""
"canbefore15","Integer","","Recommended","Before age 15, how many times did the subject use cannabis? (please check only one)","1::6; 9","1 = None; 2 = 1-4 times; 3 = 5-10 times; 4 = 11-50 times; 5 = 51-100 times; 6 = >100 times; 9 = Unknown",""
"canbetween","Integer","","Recommended","Between ages 15 and 18, how many times did the subject use cannabis? (please check only one):","1::6; 9","1 = None; 2 = 1-4 times; 3 = 5-10 times; 4 = 11-50 times; 5 = 51-100 times; 6 = >100 times; 9 = Unknown",""
"cansynage","Integer","","Recommended","Age during first use of synthetic cannabis? (specify
age in years)","","specify age in years",""
"cansyntimes","Integer","","Recommended","How many times did the subject use synthetic cannabis? (please check only one)","1::6; 9","1 = None; 2 = 1-4 times; 3 = 5-10 times; 4 = 11-50 times; 5 = 51-100 times; 6 = >100 times; 9 = Unknown",""
"cansynlast","Date","","Recommended","When was the last time the subject used synthetic
cannabis? Approximate date","","Approximate date",""
"canconfident_b2","Integer","","Recommended","How confident is the rater in the data pertinent to cannabis use? (check only one)","1::3","1 = Very confident; 2 = Moderately confident; 3 = Not confident",""
"stimconfident_b2","Integer","","Recommended","How confident is the rater in the data pertinent to stimulants use? (please check only one)","1::3","1 = Very confident; 2 = Moderately confident; 3 = Not confident",""
"cocaineconfident_b2","Integer","","Recommended","How confident is the rater in the data pertinent to cocaine use? (please check only one)","1::3","1 = Very confident; 2 = Moderately confident; 3 = Not confident",""
"hallconfident_b2","Integer","","Recommended","How confident is the rater in the data pertinent to hallucinogens use? (please check only one)","1::3","1 = Very confident; 2 = Moderately confident; 3 = Not confident",""
"opiconfident_b2","Integer","","Recommended","How confident is the rater in the data pertinent to opioids use? (please check only one)","1::3","1 = Very confident; 2 = Moderately confident; 3 = Not confident",""
"subothconfident_b2","Integer","","Recommended","How confident is the rater in the data pertinent to other substance use? (please check only one)","1::3","1 = Very confident; 2 = Moderately confident; 3 = Not confident",""
"psyhx3","Integer","","Recommended","Percentage of time past year was subject depressed","1::6; 90","1=0 -20%;2=21 -40%; 3=41 -60%;4=61 -80%; 5=81 -100%; 6=Unknown",""
"ppsyh_8","Integer","","Recommended","Percentage of time past year was subject manic or hypomanic","1::5; 6","1=0-20%; 2=20-40%; 3=40-60%; 4=60-80%; 5=80-100%; 6=Unknown",""
